<?xml version="1.0"?>
<beans xmlns:xsi="http://www.w3.org/2001/XMLSchema-instance" xsi:noNamespaceSchemaLocation="bean.xsd">
	
	<bean name="Map" class="org.pinae.simba.context.resource.MapBean">
		<property name="map">
			<map class="java.util.HashMap">
				<entity>
					<key>huiyugeng</key>
					<value>27</value>
				</entity>
				<entity>
					<key>liuchangqing</key>
					<value>24</value>
				</entity>
				<entity>
					<key>huitiantian</key>
					<reflection>Address</reflection>
				</entity>
			</map>
		</property>
	</bean>
	
</beans>
