<?xml version="1.0"?>
<beans xmlns:xsi="http://www.w3.org/2001/XMLSchema-instance" xsi:noNamespaceSchemaLocation="bean.xsd">
	
	<aop name="NameMatcherPointcutAdvisorTest">
		<target>MyTarget</target>

		<intercepyor>NameMatcherPointcutAdvisor</intercepyor>
		<intercepyor>ParameterTypesPointcutAdvisor</intercepyor>
	</aop>

	<bean name="NameMatcherPointcutAdvisor" class="org.pinae.simba.aop.pointcut.NameMatcherPointcutAdvisor">
		<property name="mappedNames">
			<list class="java.util.ArrayList">
				<value>sayHello</value>
				<value>getAge</value>
			</list>
		</property>
		<property name="advice">
			<reflection>AroundAdviceTest</reflection>
		</property>
	</bean>
	
	<bean name="ParameterTypesPointcutAdvisor" class="org.pinae.simba.aop.pointcut.ParameterTypesPointcutAdvisor">
		<property name="class">
			<value>java.lang.String</value>
		</property>
		<property name="advice">
			<reflection>BeforeAdviceTest</reflection>
		</property>
	</bean>
	
	
	<bean name="MyTarget" class="org.pinae.simba.aop.pointcut.resource.MyTarget"/>

	<bean name="AroundAdviceTest" class="org.pinae.simba.aop.pointcut.advice.AroundAdviceTest"/>
	
	<bean name="BeforeAdviceTest" class="org.pinae.simba.aop.pointcut.advice.BeforeAdviceTest"/>

</beans>
