<?xml version="1.0"?>
<beans xmlns:xsi="http://www.w3.org/2001/XMLSchema-instance" xsi:noNamespaceSchemaLocation="../bean.xsd">
	

	<bean name="PersonFactory" class="org.pinae.simba.context.resource.Person"
		factory-bean="org.pinae.simba.context.resource.PersonFactory" 
		factory-method="getPerson"
		create="create" run="run" singleton="true" 
		timeout="3" destroy="destroy">
		
		<property name="name">
			<reflection>Name</reflection>
		</property>
		<property name="age">
			<value>27</value>
		</property>
		<property name="address">
			<reflection>Address</reflection>
		</property>
		<property name="email">
			<value>interhui@21cn.com</value>
		</property>
		<property name="admin">
			<value>true</value>
		</property>
	</bean>
	
	<bean name="Name" class="org.pinae.simba.context.resource.Name">
		<constructor>
			<value>hui</value>
			<value>yugeng</value>
		</constructor>
	</bean>
	
	<bean name="Address" class="org.pinae.simba.context.resource.Address">
		<property name="country">
			<value>China</value>
		</property>
		<property name="province">
			<value>Guangdong</value>
		</property>
		<property name="city">
			<value><null/></value>
		</property>
	</bean>
</beans>
